{
  "schema_version": "palisade.compatibility-freeze.v1",
  "scope": "v1_public_contracts_and_operator_safety",
  "stable_current": {
    "api/contracts/normalized-signal-v1.json": "5adab11677a632cc841a4768653bcbb32e6de802e71c5a6775dcb33863e4f6db",
    "api/openapi.yaml": "e1fc1f0df5bbd9c8a39870647d74caafcf7fae7df73bf9a876f2e00246d4ad17",
    "api/proto/palisade/v1/challenge.proto": "c145c62ca7739fc3fd445b3de042b1e65c993948520296a7b188c10a74d7a201",
    "api/proto/palisade/v1/common.proto": "9d666665e730de1deb5ff219656b018e65161278dab644e0de3d5d49212dbe2c",
    "api/proto/palisade/v1/coverage.proto": "49888b940fdae1543ae4dadf32345adfef77ad82c9b0866cdbe81ed9f5292039",
    "api/proto/palisade/v1/decision.proto": "2627ebbe7578a79fb6dadf5dae23f822749bacece56b2811db7d3f7a10488162",
    "api/proto/palisade/v1/decoy.proto": "8689a33428423b5c36b6f5f6b6162f29d9ec54190fba801fccf98004126a2c12",
    "api/proto/palisade/v1/event.proto": "edbf5594825c8654ec6919dd6f0f03e4c3ec709a98c988a83ccbe7c294e7d745",
    "schemas/adversarial-holdout-suite-v1.schema.json": "99486cbd3fa9af64b1fbae417d4af40ec6f33145ec788fd0c0e01aac8b2c52f4",
    "schemas/adversarial-suite-v1.schema.json": "ff7433788e7636663607b74a154092f9b39ab2fb0d4820d5a2e68733e07ed21f",
    "schemas/compatibility-freeze-v1.schema.json": "df6a3386e8a276be5f6ee917003b0b3c04c643e381cdefd2a4e155b8ff279da1",
    "schemas/crawler-registry-v1.schema.json": "bab6c8185427abcd2882a8d2fc33c97947d903d1d1f254c1949ab97ada2b6708",
    "schemas/data-map-v6.schema.json": "1f8a666b78e9376aeaf516a06e5bccf43b81ef2caf349c0cdd98170ba2ed30df",
    "schemas/detector-bundle-v1.schema.json": "f5aa981fb1fac8ce5e2a1337b292e71f648aed415a39cdce1984fc51a639fcad",
    "schemas/edge-signal-envelope-v1.schema.json": "b02a57730f713505483fbaf61c8c01011d1f6ba2331c4b11ba56578bb0343b6a",
    "schemas/local-artifact-v1.schema.json": "2b1e01d8bc8adea58964eb18738a89e4754df02cd333ad1ff7b218b8d85e63c0",
    "schemas/local-evidence-event-v1.schema.json": "93d7ea8c422dc0b3020aefa24c4e2fe3ca7512bcfe459dd1c8cf097bf7da69ac",
    "schemas/local-evidence-input-v1.schema.json": "262631890833da1ec579e80fe25dd0e3e9c77f027222fb9b3154915a8b653aaa",
    "schemas/local-evidence-manifest-v1.schema.json": "d5e31f00b50523b9392db946f4a397b3feca7b25daf48ef3f7b08eeb644bb7bb",
    "schemas/local-family-annotation-v1.schema.json": "3c536a8af4362cf4eb9aea432e947d27a2e2e9d22a2274557980a36967a47bd2",
    "schemas/local-holdout-report-v1.schema.json": "f0c8c262f803047433778f592c04744294718d132c53b67ecd18f4c31df592af",
    "schemas/local-release-v1.schema.json": "f8bb4c670ffce19bf669fb8bb2f1cbfbc3c198130b013fa903393dd7f1af184d",
    "schemas/local-sequence-report-v1.schema.json": "eb8f62d0b85cfe6bd5855dc49e3baa6d5df260853a4c1a670b61ed7fd0054c8e",
    "schemas/normalized-signal-contract-v1.schema.json": "b1b6a3a910f56a8c697b3a5f23039ad41b6d63a29ee209741dc56db29df8de06",
    "schemas/offline-event-v1.schema.json": "32bccb348567b13ae5f0ad9a781690b6c77f3f21d0b9e25dc41923d0d587bde6",
    "schemas/offline-manifest-v1.schema.json": "448af0ddded79af36a0b376a72a198fd4ae6c70f7a8d365ba5bcec708ca42b45",
    "schemas/origin-adapter-conformance-v1.schema.json": "7ef341ead189b18be82e90f8e711a2236b061645a393b85936ab9335c310e2db",
    "schemas/policy-bundle-v1.schema.json": "b346e000f0c074c6e1ef97bb71102cd5389129f59ab99293659894ca0a0f7d61",
    "schemas/red-team-suite-v1.schema.json": "4e7886182d4bffdf14b09858a08c9568dc8291fef6cc4e68ed34073284c946ce",
    "schemas/rollout-plan-v2.schema.json": "60c88a1e55d0514d081165334964786060635efdda92bf879242145616b6e5d1",
    "schemas/rollout-review-v4.schema.json": "8996d23f98da787c5e1e95811f88a608bb97745cd03d8d10cbdf38c3b30ffe95",
    "schemas/runtime-egress-v1.schema.json": "71e683ffe55e4ce460ef0b31aeefa5d782227c2245a8549de093409a25271ade",
    "schemas/shadow-analysis-report-v4.schema.json": "53c9a4470660fb1796d87b498fe43e6c05bcf192c9f8fea6d0419621e6e564ea",
    "schemas/shadow-holdout-report-v1.schema.json": "de20b71d54012c84f5ee987f0f6c03541ee2c4d46a6f7ec88713d881b43ddc7d",
    "schemas/shadow-record-v3.schema.json": "f755c70d73a139ee2a435abff5ee4ed358189744c317872d7c95902cd7519065",
    "schemas/sovereignty-report-v1.schema.json": "ebbb70c457a1a74d9cc5b1f171b848420511a9388f9b4900b45bed6f3065bb74",
    "schemas/synthetic-benchmark-report-v1.schema.json": "909af816e6b66946ce6eb9bd128e3aad7594f31fb85107cc4202c2ed269236a5"
  },
  "legacy_read": {
    "schemas/shadow-record-v1.schema.json": "39683055bd51614ec822ae900166a0b1dad67679e4ccb4d99851b53ba9d138e2",
    "schemas/shadow-record-v2.schema.json": "442dd4a7fd29f9bbc994954a2a873fbd5021969a3bbcb735d255e057ed17c3b0"
  },
  "safety_documents": {
    "docs/CHALLENGE.md": "0af602dd5de0c10b405803086aa6a6aeecdb1021bce056fef07cf573351cf17d",
    "docs/COMPATIBILITY.md": "de81296f0271fb3f0232f806e7789cb6e8202d9fea6319dd4f00ad671e438ef1",
    "docs/ORIGIN_ADAPTER.md": "ce49fa1bfb971f4fdb8738465852fad6b926c163024d67fcaac190a7f9e84b31",
    "docs/RELEASING.md": "0c0caad2ceba0e70c549835e39b65efe50c3feb80ffc4b3988d494090827d699",
    "docs/REVERSE_PROXY_ADAPTER.md": "cf9e4ab46f6a47bb5ea6b2df55ea2560ce0c6488aea6d026d1d30e419402cc31",
    "docs/ROLLOUT.md": "dfd8f0766995f6241791a83e19e48fe566c7e2576973486f98d1bf732fb7ab87",
    "docs/SHADOW_LOG.md": "2db1d01424445dec97ee813ffcf587edb4ac2752faa9c77236a147ffe62ff6c5",
    "docs/THREAT_MODEL.md": "609402a903831899e6bc3650967ec4af2cdd7e910c5532b7758ee0f5360a7c0b",
    "docs/privacy/DEPLOYMENT_CHECKLIST.md": "e48a22b4b1149b562720dc6bac16a94a602e1c7f05e808f1645dcd211639d125"
  }
}
